Question,Correct Answer
What is the subject matter of Article 1 of the GDPR Regulation?,Article 1 lays down rules relating to the protection of natural persons with regard to the processing of personal data and rules relating to the free movement of personal data.
What is the material scope of Article 2 of the GDPR Regulation?,"Article 2 of the GDPR Regulation applies to the processing of personal data wholly or partly by automated means and to the processing other than by automated means of personal data which form part of a filing system or are intended to form part of a filing system. It does not apply to the processing of personal data in the course of an activity which falls outside the scope of Union law, by the Member States when carrying out activities which fall within the scope of Chapter 2 of Title V of the TEU, by a natural person in the course of a purely personal or household activity, or by competent authorities for the purposes of the prevention, investigation, detection or prosecution of criminal offences or the execution of criminal penalties, including the safeguarding against and the prevention of threats to public security."
To which processing activities does Article 3 of the GDPR Regulation apply when personal data of data subjects who are in the Union is processed by a controller or processor not established in the Union?,"Article 3 of the GDPR Regulation applies to the processing of personal data of data subjects who are in the Union by a controller or processor not established in the Union, where the processing activities are related to (a) the offering of goods or services, irrespective of whether a payment of the data subject is required, to such data subjects in the Union; or (b) the monitoring of their behaviour as far as their behaviour takes place within the Union."
What is the definition of 'processing' according to Article 4 of the GDPR Regulation?,"'Processing' means any operation or set of operations which is performed on personal data or on sets of personal data, whether or not by automated means, such as collection, recording, organisation, structuring, storage, adaptation or alteration, retrieval, consultation, use, disclosure by transmission, dissemination or otherwise making available, alignment or combination, restriction, erasure or destruction."
What is the definition of 'cross-border processing' according to Article 4?,Either processing of personal data which takes place in the context of the activities of establishments in more than one Member State of a controller or processor in the Union where the controller or processor is established in more than one Member State; or processing of personal data which takes place in the context of the activities of a single establishment of a controller or processor in the Union but which substantially affects or is likely to substantially affect data subjects in more than one Member State.
What are the six principles relating to processing of personal data according to Article 5?,"The six principles relating to processing of personal data according to Article 5 are: (a) processed lawfully, fairly and in a transparent manner in relation to the data subject (‘lawfulness, fairness and transparency’); (b) collected for specified, explicit and legitimate purposes and not further processed in a manner that is incompatible with those purposes (‘purpose limitation’); (c) adequate, relevant and limited to what is necessary in relation to the purposes for which they are processed (‘data minimisation’); (d) accurate and, where necessary, kept up to date (‘accuracy’); (e) kept in a form which permits identification of data subjects for no longer than is necessary for the purposes for which the personal data are processed (‘storage limitation’); and (f) processed in a manner that ensures appropriate security of the personal data, including protection against unauthorised or unlawful processing and against accidental loss, destruction or damage, using appropriate technical or organisational measures (‘integrity and confidentiality’)."
Under what circumstances is processing of personal data considered lawful according to Article 6?,"Processing of personal data is considered lawful if at least one of the following applies: (a) the data subject has given consent to the processing of his or her personal data for one or more specific purposes; (b) processing is necessary for the performance of a contract to which the data subject is party or in order to take steps at the request of the data subject prior to entering into a contract; (c) processing is necessary for compliance with a legal obligation to which the controller is subject; (d) processing is necessary in order to protect the vital interests of the data subject or of another natural person; (e) processing is necessary for the performance of a task carried out in the public interest or in the exercise of official authority vested in the controller; (f) processing is necessary for the purposes of the legitimate interests pursued by the controller or by a third party, except where such interests are overridden by the interests or fundamental rights and freedoms of the data subject which require protection of personal data, in particular where the data subject is a child."
"What should the request for consent be presented as, if the data subject's consent is given in the context of a written declaration which also concerns other matters?","The request for consent shall be presented in a manner which is clearly distinguishable from the other matters, in an intelligible and easily accessible form, using clear and plain language."
Under what conditions is the processing of personal data of a child lawful in relation to the offer of information society services directly to a child according to Article 8?,"The processing of personal data of a child shall be lawful where the child is at least 16 years old. Where the child is below the age of 16 years, such processing shall be lawful only if and to the extent that consent is given or authorised by the holder of parental responsibility over the child. Member States may provide by law for a lower age for those purposes provided that such lower age is not below 13 years."
"Under what circumstances is processing of personal data revealing racial or ethnic origin, political opinions, religious or philosophical beliefs, or trade union membership allowed?","Processing of personal data revealing racial or ethnic origin, political opinions, religious or philosophical beliefs, or trade union membership is allowed if the data subject has given explicit consent to the processing of those personal data for one or more specified purposes, except where Union or Member State law provide that the prohibition referred to in paragraph 1 may not be lifted by the data subject; processing is necessary for the purposes of carrying out the obligations and exercising specific rights of the controller or of the data subject in the field of employment and social security and social protection law in so far as it is authorised by Union or Member State law or a collective agreement pursuant to Member State law providing for appropriate safeguards for the fundamental rights and the interests of the data subject; processing is necessary to protect the vital interests of the data subject or of another natural person where the data subject is physically or legally incapable of giving consent; processing is carried out in the course of its legitimate activities with appropriate safeguards by a foundation, association or any other not-for-profit body with a political, philosophical, religious or trade union aim and on condition that the processing relates solely to the members or to former members of the body or to persons who have regular contact with it in connection with its purposes and that the personal data are not disclosed outside that body without the consent of the data subjects; processing relates to personal data which are manifestly made public by the data subject; processing is necessary for the establishment, exercise or defence of legal claims or whenever courts are acting in their judicial capacity; processing is necessary for reasons of substantial public interest, on the basis of Union or Member State law which shall be proportionate to the aim pursued, respect the essence of the right to data protection and provide for suitable and specific measures to safeguard the fundamental rights and the interests of the data subject; processing is necessary for reasons of public interest in the area of public health, such as protecting against serious cross-border threats to health or ensuring high standards of quality and safety of health care and of medicinal products or medical devices, on the basis of Union or Member State law which provides for suitable and specific measures to safeguard the rights and freedoms of the data subject, in particular professional secrecy; processing is necessary for archiving purposes in the public interest, scientific or historical research purposes or statistical purposes in accordance with Article 89(1) based on Union or Member State law which shall be proportionate to the aim pursued, respect the essence of the right to data protection and provide for suitable and specific measures to safeguard the fundamental rights and the interests of the data subject."
What are the obligations of a controller if the purposes for which they process personal data do not require identification of the data subject?,"If the purposes for which a controller processes personal data do not or do no longer require the identification of a data subject by the controller, the controller shall not be obliged to maintain, acquire or process additional information in order to identify the data subject for the sole purpose of complying with this Regulation."
What measures should the controller take to provide information to the data subject under Articles 13 and 14 and any communication under Articles 15 to 22 and 34?,"The controller shall take appropriate measures to provide any information referred to in Articles 13 and 14 and any communication under Articles 15 to 22 and 34 relating to processing to the data subject in a concise, transparent, intelligible and easily accessible form, using clear and plain language, in particular for any information addressed specifically to a child. The information shall be provided in writing, or by other means, including, where appropriate, by electronic means. When requested by the data subject, the information may be provided orally, provided that the identity of the data subject is proven by other means."
"What information must the controller provide to the data subject at the time when personal data are obtained, according to Article 13?","The controller must provide the data subject with the identity and contact details of the controller and, where applicable, of the controller's representative; the contact details of the data protection officer, where applicable; the purposes of the processing for which the personal data are intended as well as the legal basis for the processing; where the processing is based on point (f) of Article 6(1), the legitimate interests pursued by the controller or by a third party; the recipients or categories of recipients of the personal data, if any; where applicable, the fact that the controller intends to transfer personal data to a third country or international organisation and the existence or absence of an adequacy decision by the Commission, or in the case of transfers referred to in Article 46 or 47, or the second subparagraph of Article 49(1), reference to the appropriate or suitable safeguards and the means by which to obtain a copy of them or where they have been made available. In addition, the controller must provide the data subject with the period for which the personal data will be stored, or if that is not possible, the criteria used to determine that period; the existence of the right to request from the controller access to and rectification or erasure of personal data or restriction of processing concerning the data subject or to object to processing as well as the right to data portability; where the processing is based on point (a) of Article 6(1) or point (a) of Article 9(2), the existence of the right to withdraw consent at any time, without affecting the lawfulness of processing based on consent before its withdrawal; the right to lodge a complaint with a supervisory authority; whether the provision of personal data is a statutory or contractual requirement, or a requirement necessary to enter into a contract, as well as whether the data subject is obliged to provide the personal data and of the possible consequences of failure to provide such data; the existence of automated decision-making, including profiling, referred to in Article 22(1) and (4) and, at least in those cases, meaningful information about the logic involved, as well as the significance and the envisaged consequences of such processing for the data subject."
What information must the controller provide to the data subject in addition to the information listed in paragraph 1 of Article 14?,"The controller must provide the data subject with the period for which the personal data will be stored or the criteria used to determine that period, the legitimate interests pursued by the controller or by a third party if the processing is based on point (f) of Article 6(1), the right to request access to and rectification or erasure of personal data or restriction of processing concerning the data subject and to object to processing as well as the right to data portability, the existence of the right to withdraw consent at any time if processing is based on point (a) of Article 6(1) or point (a) of Article 9(2), the right to lodge a complaint with a supervisory authority, from which source the personal data originate, and if applicable, whether it came from publicly accessible sources, the existence of automated decision-making, including profiling, referred to in Article 22(1) and (4) and, at least in those cases, meaningful information about the logic involved, as well as the significance and the envisaged consequences of such processing for the data subject."
What information must the controller provide to the data subject when they request access to their personal data under Article 15?,"The controller must provide confirmation as to whether or not personal data concerning the data subject are being processed, and, where that is the case, access to the personal data and the following information: (a) the purposes of the processing; (b) the categories of personal data concerned; (c) the recipients or categories of recipient to whom the personal data have been or will be disclosed, in particular recipients in third countries or international organisations; (d) where possible, the envisaged period for which the personal data will be stored, or, if not possible, the criteria used to determine that period; (e) the existence of the right to request from the controller rectification or erasure of personal data or restriction of processing of personal data concerning the data subject or to object to such processing; (f) the right to lodge a complaint with a supervisory authority; (g) where the personal data are not collected from the data subject, any available information as to their source; (h) the existence of automated decision-making, including profiling, referred to in Article 22(1) and (4) and, at least in those cases, meaningful information about the logic involved, as well as the significance and the envisaged consequences of such processing for the data subject."
What is the right granted to the data subject in Article 16 of the GDPR?,"The right to obtain from the controller without undue delay the rectification of inaccurate personal data concerning him or her. Taking into account the purposes of the processing, the data subject shall have the right to have incomplete personal data completed, including by means of providing a supplementary statement."
What are the grounds for a data subject to request erasure of their personal data according to Article 17?,"The grounds for a data subject to request erasure of their personal data according to Article 17 are: (a) the personal data are no longer necessary in relation to the purposes for which they were collected or otherwise processed; (b) the data subject withdraws consent on which the processing is based according to point (a) of Article 6(1), or point (a) of Article 9(2), and where there is no other legal ground for the processing; (c) the data subject objects to the processing pursuant to Article 21(1) and there are no overriding legitimate grounds for the processing, or the data subject objects to the processing pursuant to Article 21(2); (d) the personal data have been unlawfully processed; (e) the personal data have to be erased for compliance with a legal obligation in Union or Member State law to which the controller is subject; (f) the personal data have been collected in relation to the offer of information society services referred to in Article 8(1)."
What are the circumstances under which a data subject can request restriction of processing according to Article 18?,"A data subject can request restriction of processing if (a) the accuracy of the personal data is contested, (b) the processing is unlawful and the data subject opposes erasure, (c) the controller no longer needs the data but the data subject requires it for legal claims, or (d) the data subject has objected to processing pending verification of legitimate grounds."
What is the notification obligation of the controller regarding rectification or erasure of personal data or restriction of processing according to Article 19 of the GDPR?,"The controller shall communicate any rectification or erasure of personal data or restriction of processing carried out in accordance with Article 16, Article 17(1) and Article 18 to each recipient to whom the personal data have been disclosed, unless this proves impossible or involves disproportionate effort. The controller shall inform the data subject about those recipients if the data subject requests it."
What is the right granted to the data subject in Article 20 of the GDPR?,"The data subject shall have the right to receive the personal data concerning him or her, which he or she has provided to a controller, in a structured, commonly used and machine-readable format and have the right to transmit those data to another controller without hindrance from the controller to which the personal data have been provided."
What is the right granted to the data subject in Article 21?,"The data subject shall have the right to object, on grounds relating to his or her particular situation, at any time to processing of personal data concerning him or her which is based on point (e) or (f) of Article 6(1), including profiling based on those provisions."
What is the right of the data subject under Article 22?,"The data subject shall have the right not to be subject to a decision based solely on automated processing, including profiling, which produces legal effects concerning him or her or similarly significantly affects him or her."
"Under what circumstances can Union or Member State law restrict the scope of the obligations and rights provided for in Articles 12 to 22 and Article 34, as well as Article 5?","Union or Member State law may restrict the scope of the obligations and rights provided for in Articles 12 to 22 and Article 34, as well as Article 5, when such a restriction respects the essence of the fundamental rights and freedoms and is a necessary and proportionate measure in a democratic society to safeguard national security, defence, public security, the prevention, investigation, detection or prosecution of criminal offences or the execution of criminal penalties, including the safeguarding against and the prevention of threats to public security, other important objectives of general public interest of the Union or of a Member State, in particular an important economic or financial interest of the Union or of a Member State, including monetary, budgetary and taxation a matters, public health and social security, the protection of judicial independence and judicial proceedings, the prevention, investigation, detection and prosecution of breaches of ethics for regulated professions, a monitoring, inspection or regulatory function connected, even occasionally, to the exercise of official authority in the cases referred to in points (a) to (e) and (g), the protection of the data subject or the rights and freedoms of others, or the enforcement of civil law claims."
What measures should the controller implement to ensure and demonstrate that processing is performed in accordance with the GDPR Regulation?,"The controller shall implement appropriate technical and organisational measures, reviewed and updated where necessary, taking into account the nature, scope, context and purposes of processing as well as the risks of varying likelihood and severity for the rights and freedoms of natural persons. Where proportionate in relation to processing activities, the measures shall include the implementation of appropriate data protection policies."
What are the two types of measures that the controller must implement according to Article 25?,"The controller must implement appropriate technical and organisational measures to implement data-protection principles, such as data minimisation, and to ensure that only necessary personal data are processed."
What are the responsibilities of joint controllers under Article 26 of the GDPR Regulation?,"Joint controllers must determine their respective responsibilities for compliance with the obligations under this Regulation, in particular as regards the exercising of the rights of the data subject and their respective duties to provide the information referred to in Articles 13 and 14, by means of an arrangement between them unless, and in so far as, the respective responsibilities of the controllers are determined by Union or Member State law to which the controllers are subject. The arrangement may designate a contact point for data subjects. The arrangement shall duly reflect the respective roles and relationships of the joint controllers vis-à-vis the data subjects. The essence of the arrangement shall be made available to the data subject. Irrespective of the terms of the arrangement referred to in paragraph 1, the data subject may exercise his or her rights under this Regulation in respect of and against each of the controllers."
When is a controller or processor not established in the Union exempt from designating a representative in the Union under Article 27?,"The obligation laid down in paragraph 1 of this Article shall not apply to: (a) processing which is occasional, does not include, on a large scale, processing of special categories of data as referred to in Article 9(1) or processing of personal data relating to criminal convictions and offences referred to in Article 10, and is unlikely to result in a risk to the rights and freedoms of natural persons, taking into account the nature, context, scope and purposes of the processing; or (b) a public authority or body."
"What are the obligations of a processor under a contract or other legal act with the controller, according to Article 28?","The obligations of a processor under a contract or other legal act with the controller, according to Article 28, include processing personal data only on documented instructions from the controller, ensuring confidentiality of persons authorized to process the data, taking all measures required pursuant to Article 32, respecting the conditions for engaging another processor, assisting the controller by appropriate technical and organizational measures, assisting the controller in ensuring compliance with the obligations pursuant to Articles 32 to 36, deleting or returning all the personal data to the controller after the end of the provision of services relating to processing, making available to the controller all information necessary to demonstrate compliance with the obligations laid down in this Article and allow for and contribute to audits, including inspections, conducted by the controller or another auditor mandated by the controller, and immediately informing the controller if, in its opinion, an instruction infringes this Regulation or other Union or Member State data protection provisions."
Under what circumstances can the processor or any person acting under the authority of the controller or processor process personal data?,"The processor and any person acting under the authority of the controller or of the processor, who has access to personal data, shall not process those data except on instructions from the controller, unless required to do so by Union or Member State law."
